ShapeName,Slug,Synonyms,Category,Description,HistoryBlurb,HistoryBlurb_Source,CityOrRegionMostAssociated,EarliestAttestedMention,SourceLink,PrimaryGeometry,KeyDiscriminators,Type,IsHollow,IsRidged,IsTwisted,IsCurved,SizeClass,IsStuffed,ThumbnailImage,PhotoImage,SearchAliases,HeroImageUncooked,HeroImageCooked,KeyTells,OftenConfusedWith,OftenConfusedWithWhy,BestFor,BestFor_Source,ClassicSaucePairings,ClassicSaucePairingsWhy,AvoidWith,AvoidWithWhy,SubstitutesClosest,SubstitutesClosestWhy,SubstitutesDecent,SubstitutesDecentWhy,SubstitutesEmergency,SubstitutesEmergencyWhy,MadeMethod,OriginRegion,Pronunciation,NameMeaning,Trivia,RecipeLinks,SeeAlsoSlugs,Book_MatchedEntry,Book_MatchScore,Book_MatchRunnerUpScore,Book_MatchFromAlias
Bucatini,bucatini,perciatelli; Boccolotti; candele; ﬁdelini bucati; perciatellini; perciatelloni; regine; zitior zite; according to diameter; but also mez- zani; scaloppi; in Sicily; ﬁlatu cu lu pirtusu; maccarruncinu,Long,,"Today, the term b ucatini, literally “pierced,” is used for a factory- made dry pasta. But the early fresh bucatino, made by rolling a small piece of dough on a ferre tto,a rush, or a smooth stick, is still found in various sizes (see…",,,,,Strand,,strand,1,0,0,0,medium,0,bucatini.png,,perciateli; perciatelli; Boccolotti; candele; ﬁdelini bucati; perciatellini; perciatelloni; regine; zitior zite; according to diameter; but also mez- zani; scaloppi; in Sicily; ﬁlatu cu lu pirtusu; maccarruncinu,,,strand; medium size; Smooth surface; Hollow center,Spaghetti Alla Chitarra; Bigoli; Capelli D'Angelo; Capellini,Spaghetti Alla Chitarra - hollow vs solid | Bigoli - hollow vs solid,Pastasciutta; Soup; Baked,,Light olive oil sauces; Tomato sauces; Seafood sauces,Long strands prefer sauces that coat evenly without heavy chunks.,,,Spaghetti Alla Chitarra,hollow vs solid,Bigoli; Capelli D'Angelo,Bigoli - hollow vs solid | Capelli D'Angelo - hollow vs solid,Capellini,hollow vs solid,extruded,,,,,,,bucatini,100.0,67.5,Bucatini
Scialatelli,scialatelli,,Long,,"The origin of the word lies in the Neapolitan dialect verb sciglià,for Italian scompigliare, “to dishevel,” referring to hair: these sciliatelli must be thin and scompigliati,or “disheveled,” which is how they look, steaming in their dish. In Basilicata, sciliatelliare thick fettuccine,not longer than 4 to 5 inches (10 to 12cm), made with a par… Where it’s most associated: Campania, a specialty of Minori, on the Amalfi coast; Basilicata; and Calabria, especially Cosenza.","Encyclopedia of Pasta (matched 'scialatielli', score 95.7)",,,,Ribbon,,ribbon,0,0,0,0,medium,0,scialatelli.png,,scialateli,,,ribbon; medium size; Smooth surface,Mafaldine; Pappardelle; Tagliatelle; Mafalde,Mafaldine - Very similar geometry | Pappardelle - Very similar geometry,"Generally as pastasciutta,with traditional local sauces, including ragù of brains (of lamb, not too young) in Calabria, but more commonly pork ragù","Encyclopedia of Pasta (matched 'scialatielli', score 95.7)",Cream sauces; Mushroom sauces; Slow-cooked ragù,Broad surfaces carry creamy or clingy sauces well.,,,Mafaldine,Very similar geometry,Pappardelle; Tagliatelle,Pappardelle - Very similar geometry | Tagliatelle - Very similar geometry,Mafalde,Very similar geometry,rolled-cut,,,,,,,scialatielli,95.65217391304348,80.0,Scialatelli
Tagliatelle,tagliatelle,Adige; tagliatelle smalzade; eneto; around Cortina d’Ampezzo; lesagnetes; in Lombardy; bardele. In Tuscany; in the Val- darno; they are called maccheroni; in Lazio; they are fettuccine; though at Colonna; tagliatini; taglierini; tagliarini; tagliolini pelosi; but also tajulì; taglioli pelosi. In Emilia- Romagna; bassotti; in the Marche; around Subiaco; in the Sabina; curi- oli.In Abruzzo; Molise; they are tajarille; in Puglia; around Taranto; tag- ghjarine; tagghjaridde. In Sicily; they are tagghiarini; in Sardinia; lar; taddarini. For factory- made tagliatelle; nastri (tapes); fettucce romane; fettuccelle; fresine; capelvenere. Some are packaged in nests.,Long,,"The name derives from the verb tagliare, “to cut.” Tagl iatelle used to be reserved for feast days, but are extremely common today , served any day of the week. Bologna boasts that it is the birthplace of tagliatelle, citing the legend of…",,,,,Ribbon,,ribbon,0,0,0,0,medium,0,tagliatelle.png,,tagliatele; Adige; tagliatelle smalzade; eneto; around Cortina d’Ampezzo; lesagnetes; in Lombardy; bardele. In Tuscany; in the Val- darno; they are called maccheroni; in Lazio; they are fettuccine; though at Colonna; tagliatini; taglierini; tagliarini; tagliolini pelosi; but also tajulì; taglioli pelosi. In Emilia- Romagna; bassotti; in the Marche; around Subiaco; in the Sabina; curi- oli.In Abruzzo; Molise; they are tajarille; in Puglia; around Taranto; tag- ghjarine; tagghjaridde. In Sicily; they are tagghiarini; in Sardinia; lar; taddarini. For factory- made tagliatelle; nastri (tapes); fettucce romane; fettuccelle; fresine; capelvenere. Some are packaged in nests.,,,ribbon; medium size; Smooth surface,Mafaldine; Scialatelli; Pappardelle; Mafalde,Mafaldine - Very similar geometry | Scialatelli - Very similar geometry,Pastasciutta; Soup,,Cream sauces; Mushroom sauces; Slow-cooked ragù,Broad surfaces carry creamy or clingy sauces well.,,,Mafaldine,Very similar geometry,Scialatelli; Pappardelle,Scialatelli - Very similar geometry | Pappardelle - Very similar geometry,Mafalde,Very similar geometry,sheet-formed,,,,,,,tagliolini pelosi,100.0,71.25,tagliolini pelosi
Mafalde,mafalde,Mafaldine; signorine; trinette; ricciarelle; sfresatine.,Long,,"The name means literally “[Princess] Mafalda.” At the beginning of the twentieth century , a small group of pastas was dedicated to the House of Savoy , the new monarchs of Italy . Thus, we have regine, “queens,” and their diminu- tives…",,,,,Ribbon,,ribbon,0,0,0,0,medium,0,mafalde.png,,Mafaldine; signorine; trinette; ricciarelle; sfresatine.,,,ribbon; medium size; Smooth surface,Mafaldine; Scialatelli; Tagliatelle; Pappardelle,Mafaldine - Very similar geometry | Scialatelli - Very similar geometry,Pastasciutta,,Cream sauces; Mushroom sauces; Slow-cooked ragù,Broad surfaces carry creamy or clingy sauces well.,,,Mafaldine,Very similar geometry,Scialatelli; Tagliatelle,Scialatelli - Very similar geometry | Tagliatelle - Very similar geometry,Pappardelle,Very similar geometry,extruded,,,,,,,,78.75,77.14285714285715,trinette
Spaghetti,spaghetti,spaghettini (thin); spaghettoni (thick); vermicelli (intermediate); Fide; in Sicily; ﬁdillini. For the thinnest; capelli d’angelo (angel hair); capellini (hair); capelvenere (V enus’s hair); f edelini; ﬁdelini; sopracapellini; but also mezzi vermicelli; spaghettini; vermicellini. For the thickest; ﬁlatelli; spaghet- toni; vermicelloni; verm icelloni giganti.,Long,,"The root of the word spaghetti is simple: it means a small string, ex- actly as the ﬁrst, handmade, vaguely irregular spaghetti must have been. The name for this pasta is a house hold word on every continent and a synonym for “made in…",,,,,Strand,,strand,0,0,0,0,medium,0,spaghetti.png,,spagheti; vermiceli; spaghetini; spaghetoni; vermicelli; spaghettini; spaghettoni; Fide; in Sicily; ﬁdillini. For the thinnest; capelli d’angelo (angel hair); capellini (hair); capelvenere (V enus’s hair); f edelini; ﬁdelini; sopracapellini; but also mezzi vermicelli; vermicellini. For the thickest; ﬁlatelli; spaghet- toni; vermicelloni; verm icelloni giganti.,,,strand; medium size; Smooth surface,Vermicelli; Bigoli; Fedelini; Spaghetti Alla Chitarra,Vermicelli - Very similar geometry | Bigoli - Very similar geometry,Pastasciutta; Soup,,Light olive oil sauces; Tomato sauces; Seafood sauces,Long strands prefer sauces that coat evenly without heavy chunks.,,,Vermicelli,Very similar geometry,Bigoli; Fedelini,Bigoli - Very similar geometry | Fedelini - Very similar geometry,Spaghetti Alla Chitarra,Very similar geometry,extruded,,,,,,,spaghetti,100.0,63.1578947368421,Spaghetti
Sagne Torte,sagne-torte,,Sheet,,,,,,,Twist,,sheet,0,0,0,1,medium,0,sagne-torte.png,,torte sagne,,,sheet; medium size; Smooth surface; Curved shape,Nuvole; Fisckariedd'; Pantacce; Fricelli,Nuvole - Very similar geometry | Fisckariedd' - curved vs plain,,,Cream sauces; Mushroom sauces; Slow-cooked ragù,Broad surfaces carry creamy or clingy sauces well.,,,Nuvole,Very similar geometry,Fisckariedd'; Pantacce,Fisckariedd' - curved vs plain | Pantacce - curved vs plain,Fricelli,curved vs plain; different type,rolled-cut,,,,,,,,85.5,65.45454545454547,Sagne Torte
Linguine,linguine,,Long,,"Linguine (""little tongues"") are long, slightly flattened strands associated with Genoa/Liguria, closely related to shapes like bavette and trenette in the same regional pasta family.",https://www.the-pasta-project.com/linguine-pasta-from-liguria/,,,,Ribbon,,ribbon,0,0,0,0,medium,0,linguine.png,,,,,ribbon; medium size; Smooth surface,Mafaldine; Scialatelli; Tagliatelle; Mafalde,Mafaldine - Very similar geometry | Scialatelli - Very similar geometry,Pesto and seafood sauces - the flattened profile gives more surface area than spaghetti for sauces to cling without overwhelming the pasta.,https://www.the-pasta-project.com/linguine-pasta-from-liguria/,Cream sauces; Mushroom sauces; Slow-cooked ragù,Broad surfaces carry creamy or clingy sauces well.,,,Mafaldine,Very similar geometry,Scialatelli; Tagliatelle,Scialatelli - Very similar geometry | Tagliatelle - Very similar geometry,Mafalde,Very similar geometry,rolled-cut,,,,,,,,67.5,66.66666666666667,Linguine
Pici,pici,In Tuscany; they are called pinci in Montepulciano; lunghetti; ciriole; strangozzi; stringozzi in Montalcino. In Umbria; Lazio,Long,,"This is a very old pasta shape from southern Tuscany , which local his- torians try to trace to the Etruscans. Today , piciare a tasty and rich dish, and many pop u lar sagre are dedicated to this pasta.",,,,,Strand,,strand,0,0,0,0,medium,0,pici.png,,In Tuscany; they are called pinci in Montepulciano; lunghetti; ciriole; strangozzi; stringozzi in Montalcino. In Umbria; Lazio,,,strand; medium size; Smooth surface,Vermicelli; Bigoli; Fedelini; Spaghetti Alla Chitarra,Vermicelli - Very similar geometry | Bigoli - Very similar geometry,Pastasciutta,,Light olive oil sauces; Tomato sauces; Seafood sauces,Long strands prefer sauces that coat evenly without heavy chunks.,,,Vermicelli,Very similar geometry,Bigoli; Fedelini,Bigoli - Very similar geometry | Fedelini - Very similar geometry,Spaghetti Alla Chitarra,Very similar geometry,sheet-formed,,,,,,,pici,100.0,77.14285714285715,Pici
Canule,canule,,Long,,,,,,,Strand,,strand,0,0,0,0,medium,0,canule.png,,,,,strand; medium size; Smooth surface,Vermicelli; Bigoli; Fedelini; Spaghetti Alla Chitarra,Vermicelli - Very similar geometry | Bigoli - Very similar geometry,,,Light olive oil sauces; Tomato sauces; Seafood sauces,Long strands prefer sauces that coat evenly without heavy chunks.,,,Vermicelli,Very similar geometry,Bigoli; Fedelini,Bigoli - Very similar geometry | Fedelini - Very similar geometry,Spaghetti Alla Chitarra,Very similar geometry,extruded,,,,,,,,75.00000000000001,75.00000000000001,Canule
Busiate,busiate,busiata trapanese; busiati,Short,,"Busiate are long, hand-rolled helical strands from Sicily (especially the Trapani area), traditionally wound around a local grass stem or thin rod.",https://en.wikipedia.org/wiki/Busiate; https://www.eataly.com/us_en/back-to-basics-busiate-con-pesto-alla-trapanese,,,,Twist,,short,1,0,1,0,medium,0,busiate.png,,busiati; busiata trapanese,,,short; medium size; Smooth surface; Hollow center; Twisted / spiral form,Fusi Istriani; Ciocchetti; Gemelli; Dischi,Fusi Istriani - Very similar geometry | Ciocchetti - hollow vs solid,"Pesto alla Trapanese (tomato, almonds, basil, garlic) - the classic pairing; also works with light seafood sauces.",https://www.the-pasta-project.com/busiate-pasta-trapanese-pesto-trapani/; https://en.wikipedia.org/wiki/Busiate,Tomato sauces; Cream sauces; Pesto,Versatile shape - pair by sauce thickness.,,,Fusi Istriani,Very similar geometry,Ciocchetti; Gemelli,Ciocchetti - hollow vs solid | Gemelli - hollow vs solid,Dischi,hollow vs solid,extruded,,,,,,,,77.14285714285715,65.45454545454547,Busiate
Bavette,bavette,The thinnest are bavettine; linguine (small tongues); lingue di passero (sparrow’s tongues); linguettine; fettuccelle; fresine; tagliarelli; tagliatelle. And ﬁnally; there are fettucce; fettuccine; lasagnette; pappardelle. In Sicily; they are called lasagneddi.,Long,,"Bavetta is an early term, possibly from the French, attested already in the thirteenth century as a derivative of baba or bava, or “drool.” In any case, Fan- fani’s 1863 dictionary 24contains a reference to a pasta of this name ( specie di…",,,,,Ribbon,,ribbon,0,0,0,0,medium,0,bavette.png,,bavete; The thinnest are bavettine; linguine (small tongues); lingue di passero (sparrow’s tongues); linguettine; fettuccelle; fresine; tagliarelli; tagliatelle. And ﬁnally; there are fettucce; fettuccine; lasagnette; pappardelle. In Sicily; they are called lasagneddi.,,,ribbon; medium size; Smooth surface,Mafaldine; Scialatelli; Tagliatelle; Mafalde,Mafaldine - Very similar geometry | Scialatelli - Very similar geometry,Pastasciutta; Soup,,Cream sauces; Mushroom sauces; Slow-cooked ragù,Broad surfaces carry creamy or clingy sauces well.,,,Mafaldine,Very similar geometry,Scialatelli; Tagliatelle,Scialatelli - Very similar geometry | Tagliatelle - Very similar geometry,Mafalde,Very similar geometry,extruded,,,,,,,bavette,100.0,80.0,Bavette
Fettuccine,fettuccine,No alternative names.,Long,,"This dish is prepared for Passover, or Pesach, when leavened or fer- mented food is prohibited for several days, hence the use of matzos crushed into ﬂour. The same dough is used to make small maltagliati, which are also served in broth…",,,,,Ribbon,,ribbon,0,0,0,0,medium,0,fettuccine.png,,fetucinea; No alternative names.,,,ribbon; medium size; Smooth surface,Mafaldine; Scialatelli; Tagliatelle; Mafalde,Mafaldine - Very similar geometry | Scialatelli - Very similar geometry,Soup,,Cream sauces; Mushroom sauces; Slow-cooked ragù,Broad surfaces carry creamy or clingy sauces well.,,,Mafaldine,Very similar geometry,Scialatelli; Tagliatelle,Scialatelli - Very similar geometry | Tagliatelle - Very similar geometry,Mafalde,Very similar geometry,sheet-formed,,,,,,,fettucce,88.88888888888889,67.5,Fettuccine
Fettuccelli,fettuccelli,,Long,,,,,,,Ribbon,,ribbon,0,0,0,0,medium,0,fettuccelli.png,,fetuceli,,,ribbon; medium size; Smooth surface,Mafaldine; Scialatelli; Tagliatelle; Mafalde,Mafaldine - Very similar geometry | Scialatelli - Very similar geometry,,,Cream sauces; Mushroom sauces; Slow-cooked ragù,Broad surfaces carry creamy or clingy sauces well.,,,Mafaldine,Very similar geometry,Scialatelli; Tagliatelle,Scialatelli - Very similar geometry | Tagliatelle - Very similar geometry,Mafalde,Very similar geometry,rolled-cut,,,,,,,,84.21052631578947,60.00000000000001,Fettuccelli
Lasagne,lasagne,lasagna (sing. in some usage); Lasagne matte (crazy). In Lunigiana; armelette.,Sheet,,"Literally “bastard lasagne, ” they take their name from their reliance on lesser ﬂours, such as chestnut, the use of which helped to save on costly wheat152 lasagne bastarde ﬂour, a luxury in rural homes. The woods of the Lunigiana have…",https://en.wikipedia.org/wiki/Lasagna; https://www.lacucinaitaliana.com/italian-food/italian-dishes/lasagna-origins-and-varieties-of-the-beloved-baked-pasta,,,,Sheet,,sheet,0,0,0,0,medium,0,lasagne.png,,lasagna; Lasagne matte (crazy). In Lunigiana; armelette.,,,sheet; medium size; Smooth surface,Fisckariedd'; Pantacce; Sagnarelli; Lasagnette,Fisckariedd' - Very similar geometry | Pantacce - Very similar geometry,"Layered, baked casseroles (lasagne al forno) with ragù, béchamel, cheeses, and vegetables; also used regionally in broth preparations.",https://en.wikipedia.org/wiki/Lasagna,Cream sauces; Mushroom sauces; Slow-cooked ragù,Broad surfaces carry creamy or clingy sauces well.,,,Fisckariedd',Very similar geometry,Pantacce; Sagnarelli,Pantacce - Very similar geometry | Sagnarelli - Very similar geometry,Lasagnette,Very similar geometry,sheet-formed,,,,,,,,76.92307692307692,75.00000000000001,Lasagne
Lasagnette,lasagnette,,Sheet,,"Lasagnette are smaller lasagna-style ribbons/sheets; edges may be straight or wavy, and they’re commonly used either in thinner layered bakes or tossed with typical lasagna ingredients.",https://en.wikipedia.org/wiki/Lasagnette ; https://en.wikipedia.org/wiki/Lasagna,,,,Sheet,,sheet,0,0,0,0,medium,0,lasagnette.png,,lasagnete,,,sheet; medium size; Smooth surface,Fisckariedd'; Pantacce; Sagnarelli; Lasagne,Fisckariedd' - Very similar geometry | Pantacce - Very similar geometry,Pastasciutta; Baked,https://en.wikipedia.org/wiki/Lasagnette,Cream sauces; Mushroom sauces; Slow-cooked ragù,Broad surfaces carry creamy or clingy sauces well.,,,Fisckariedd',Very similar geometry,Pantacce; Sagnarelli,Pantacce - Very similar geometry | Sagnarelli - Very similar geometry,Lasagne,Very similar geometry,rolled-cut,,,,,,,,67.5,63.1578947368421,Lasagnette
Lasagne Ricce,lasagne-ricce,,Sheet,,"Lasagne ricce are lasagna sheets with wavy (ruffled) edges. The ruffles help trap sauce, and they’re among the many traditional lasagne variations used across Italy.",https://www.dececco.com/gb_en/product/lasagna-riccia-n-1/ ; https://en.wikipedia.org/wiki/Lasagna,,,,Sheet,,sheet,0,1,0,0,medium,0,lasagne-ricce.png,,lasagne rice; ricce lasagne,,,sheet; medium size; Ridged surface,Pantacce; Sagnarelli; Fisckariedd'; Lasagne,Pantacce - ridged vs smooth | Sagnarelli - ridged vs smooth,Baked,https://www.dececco.com/gb_en/product/lasagna-riccia-n-1/,Cream sauces; Mushroom sauces; Slow-cooked ragù,Broad surfaces carry creamy or clingy sauces well.,,,Pantacce,ridged vs smooth,Sagnarelli; Fisckariedd',Sagnarelli - ridged vs smooth | Fisckariedd' - ridged vs smooth,Lasagne,ridged vs smooth,extruded,,,,,,,,72.0,67.5,ricce lasagne
Linguettine,linguettine,,Short,,,,,,,Other,,short,0,1,0,1,medium,0,linguettine.png,,linguetine,,,short; medium size; Ridged surface; Curved shape,Perciatelli; Lanterne; Creste Di Gallo; Torchio,Perciatelli - Very similar geometry | Lanterne - Very similar geometry,,,Tomato sauces; Cream sauces; Pesto,Versatile shape - pair by sauce thickness.,,,Perciatelli,Very similar geometry,Lanterne; Creste Di Gallo,Lanterne - Very similar geometry | Creste Di Gallo - Very similar geometry,Torchio,Very similar geometry,extruded,,,,,,,,67.5,64.28571428571429,Linguettine
Mafaldine,mafaldine,reginette; mafalde,Long,,"Mafaldine (also called reginette) are ribbon pasta with wavy edges, named in honor of Princess Mafalda of Savoy and associated with the Naples area.",https://en.wikipedia.org/wiki/Mafaldine; https://www.thepetitecook.com/mafaldine-pasta/,,,,Ribbon,,ribbon,0,0,0,0,medium,0,mafaldine.png,,mafalde; reginete; reginette,,,ribbon; medium size; Smooth surface,Scialatelli; Tagliatelle; Mafalde; Tripoline,Scialatelli - Very similar geometry | Tagliatelle - Very similar geometry,"Rich ragùs (meat sauces) and other hearty, clingy sauces that can catch on the ruffled edges.",https://en.wikipedia.org/wiki/Mafaldine; https://www.thislittleplate.com/recipes/dinner/pork-sausage-ragu-bianco-with-mafaldine-pasta,Cream sauces; Mushroom sauces; Slow-cooked ragù,Broad surfaces carry creamy or clingy sauces well.,,,Scialatelli,Very similar geometry,Tagliatelle; Mafalde,Tagliatelle - Very similar geometry | Mafalde - Very similar geometry,Tripoline,Very similar geometry,rolled-cut,,,,,,,reginette toscane,90.0,74.8125,reginette
Pappardelle,pappardelle,Paparele in the V eneto; paspadelle in the Marche.,Long,,"Pappardelle is actually a Tuscan dialect term that derives from pappare, “to eat,” and in the region they are extensively used, especially with hearty sauces, sometimes containing game. The term is also now used extensively else-where in…",,,,,Ribbon,,ribbon,0,0,0,0,medium,0,pappardelle.png,,papardele; Paparele in the V eneto; paspadelle in the Marche.,,,ribbon; medium size; Smooth surface,Mafaldine; Scialatelli; Tagliatelle; Mafalde,Mafaldine - Very similar geometry | Scialatelli - Very similar geometry,Pastasciutta,,Cream sauces; Mushroom sauces; Slow-cooked ragù,Broad surfaces carry creamy or clingy sauces well.,,,Mafaldine,Very similar geometry,Scialatelli; Tagliatelle,Scialatelli - Very similar geometry | Tagliatelle - Very similar geometry,Mafalde,Very similar geometry,sheet-formed,,,,,,,pappardelle,100.0,65.45454545454547,Pappardelle
Pillus,pillus,Lisanzedas.,Long,,"The practice of making mutton broth is ancient and typical of all the highly pastoral regions. Indeed, it was widespread in ancient Greece, and mutton broth is still made today in Greece for Easter.",,,,,Strand,,strand,0,0,0,0,medium,0,pillus.png,,pilus; Lisanzedas.,,,strand; medium size; Smooth surface,Vermicelloni; Bigoli; Fedelini; Spaghetti Alla Chitarra,Vermicelloni - Very similar geometry | Bigoli - Very similar geometry,Baked,,Light olive oil sauces; Tomato sauces; Seafood sauces,Long strands prefer sauces that coat evenly without heavy chunks.,,,Vermicelloni,Very similar geometry,Bigoli; Fedelini,Bigoli - Very similar geometry | Fedelini - Very similar geometry,Spaghetti Alla Chitarra,Very similar geometry,sheet-formed,,,,,,,pillus,100.0,60.00000000000001,Pillus
Tripoline,tripoline,,Long,,"Tripoline are long ribbons with one ruffled edge (similar to mafalda, but ruffled on one side). They’re often linked to Campania and, by tradition, were created in Naples in honor of King Victor Emmanuel II.",https://www.dececco.com/gb_en/product/tripoline-n-3/ ; https://sharethepasta.org/pasta-shapes/tripolini/,,,,Ribbon,,ribbon,0,0,0,0,medium,0,tripoline.png,,,,,ribbon; medium size; Smooth surface,Mafaldine; Scialatelli; Tagliatelle; Mafalde,Mafaldine - Very similar geometry | Scialatelli - Very similar geometry,Pastasciutta,https://www.dececco.com/gb_en/product/tripoline-n-3/,Cream sauces; Mushroom sauces; Slow-cooked ragù,Broad surfaces carry creamy or clingy sauces well.,,,Mafaldine,Very similar geometry,Scialatelli; Tagliatelle,Scialatelli - Very similar geometry | Tagliatelle - Very similar geometry,Mafalde,Very similar geometry,rolled-cut,,,,,,,,77.14285714285715,67.5,Tripoline
Trenette,trenette,Linguine; bavette.,Long,,"Today , it is a gourmet treat, but both yesterday and today “advan- taged” pasta— which is what avvant aggiatameans literally , that is, containing some whole- wheat ﬂour— costs less than the normal white pasta made entirely with white…",,,,,Ribbon,,ribbon,0,0,0,0,medium,0,trenette.png,,trenete; Linguine; bavette.,,,ribbon; medium size; Smooth surface,Mafaldine; Scialatelli; Tagliatelle; Mafalde,Mafaldine - Very similar geometry | Scialatelli - Very similar geometry,Pastasciutta,,Cream sauces; Mushroom sauces; Slow-cooked ragù,Broad surfaces carry creamy or clingy sauces well.,,,Mafaldine,Very similar geometry,Scialatelli; Tagliatelle,Scialatelli - Very similar geometry | Tagliatelle - Very similar geometry,Mafalde,Very similar geometry,extruded,,,,,,,bavette,100.0,80.0,bavette.
Spaghetti Alla Chitarra,spaghetti-alla-chitarra,maccheroni alla chitarra,Long,,"The chitarraconsists of a wooden frame (beech or other neutral wood) strung with parallel steel wires. The space between the wires varies according to the type of pasta desired. Where it’s most associated: Lazio; Abruzzo, especially around Scanno; upper Molise; the Marche; and Puglia.","Encyclopedia of Pasta (matched 'maccheroni alla chitarra', score 100.0)",,,,Strand,,strand,0,0,0,0,medium,0,spaghetti-alla-chitarra.png,,spagheti chitarra; spaghetti chitara; chitarra spaghetti; maccheroni chitara; macheroni chitarra; spaghetti chitarra; chitarra maccheroni; maccheroni chitarra; maccheroni alla chitarra,,,strand; medium size; Smooth surface,Vermicelloni; Bigoli; Fedelini; Matriciani,Vermicelloni - Very similar geometry | Bigoli - Very similar geometry,"Traditionally with muttonragù,but today also with other sauces","Encyclopedia of Pasta (matched 'maccheroni alla chitarra', score 100.0)",Light olive oil sauces; Tomato sauces; Seafood sauces,Long strands prefer sauces that coat evenly without heavy chunks.,,,Vermicelloni,Very similar geometry,Bigoli; Fedelini,Bigoli - Very similar geometry | Fedelini - Very similar geometry,Matriciani,Very similar geometry,extruded,,,,,,,maccheroni alla chitarra,100.0,85.26315789473685,maccheroni alla chitarra
Stringozzi,stringozzi,,Long,,"Some people believe the name derives from the word stringa,literally “string” or “shoelace,” from the elongated shape that recalls the thick shoelaces of long ago. Like other s o-c alled poor pastas, this pasta was reserved for feast days and other holidays. Where it’s most associated: Umbria, especially Foligno and Spoleto; in EmiliaRomagna; and in northern Lazio.","Encyclopedia of Pasta (matched 'stringozzi', score 100.0)",,,,Strand,,strand,0,0,0,1,medium,0,stringozzi.png,,stringozi,,,strand; medium size; Smooth surface; Curved shape,Pellizzoni; Spaghettini; Spaghettoni; Vermicelli,Pellizzoni - curved vs plain | Spaghettini - curved vs plain,"With various sauces, with herbs, truffles, or funghi porcini","Encyclopedia of Pasta (matched 'stringozzi', score 100.0)",Light olive oil sauces; Tomato sauces; Seafood sauces,Long strands prefer sauces that coat evenly without heavy chunks.,,,Pellizzoni,curved vs plain,Spaghettini; Spaghettoni,Spaghettini - curved vs plain | Spaghettoni - curved vs plain,Vermicelli,curved vs plain,extruded,,,,,,,stringozzi,100.0,67.5,Stringozzi
