ShapeName,Slug,Synonyms,Category,Description,HistoryBlurb,HistoryBlurb_Source,CityOrRegionMostAssociated,EarliestAttestedMention,SourceLink,PrimaryGeometry,KeyDiscriminators,Type,IsHollow,IsRidged,IsTwisted,IsCurved,SizeClass,IsStuffed,ThumbnailImage,PhotoImage,SearchAliases,HeroImageUncooked,HeroImageCooked,KeyTells,OftenConfusedWith,OftenConfusedWithWhy,BestFor,BestFor_Source,ClassicSaucePairings,ClassicSaucePairingsWhy,AvoidWith,AvoidWithWhy,SubstitutesClosest,SubstitutesClosestWhy,SubstitutesDecent,SubstitutesDecentWhy,SubstitutesEmergency,SubstitutesEmergencyWhy,MadeMethod,OriginRegion,Pronunciation,NameMeaning,Trivia,RecipeLinks,SeeAlsoSlugs,Book_MatchedEntry,Book_MatchScore,Book_MatchRunnerUpScore,Book_MatchFromAlias
Pennette,pennette,,Short,,"The name means literally “quills.” In 1865, Giovanni Battista Capurro, a pasta maker of San Martino d’Albaro (Genoa), asked for and obtained a monopoly on the manufacture of a diagonal cutting machine. The machine made it possible to cut the fresh pasta tubes on the bias, in various sizes between 11/ 4and 2 inches (3 and 5cm), without flattening… Where it’s most associated: Widespread.","Encyclopedia of Pasta (matched 'penne', score 90.0)",,,,Tube,,tube,1,1,0,0,small,0,pennette.png,,penete,,,tube; small size; Ridged surface; Hollow center,Rigatoncini; Ditalini; Maccheroncini; Cannolocchi,Rigatoncini - Very similar geometry | Ditalini - ridged vs smooth,"Depending on size, as pastasciuttaor in broth","Encyclopedia of Pasta (matched 'penne', score 90.0)",Chunky tomato sauces; Meat ragù; Baked casseroles,Ridges grip sauce.,,,Rigatoncini,Very similar geometry,Ditalini; Maccheroncini,Ditalini - ridged vs smooth | Maccheroncini - different size,Cannolocchi,different size,extruded,,,,,,,penne,90.0,73.28571428571429,Pennette
Ondule,ondule,,Short,,,,,,,Other,,short,0,1,0,0,medium,0,ondule.png,,,,,short; medium size; Ridged surface,Capricci; Assabesi; Francesine; Marziani,Capricci - Very similar geometry | Assabesi - Very similar geometry,,,Tomato sauces; Cream sauces; Pesto,Versatile shape - pair by sauce thickness.,,,Capricci,Very similar geometry,Assabesi; Francesine,Assabesi - Very similar geometry | Francesine - Very similar geometry,Marziani,Very similar geometry,extruded,,,,,,,,60.00000000000001,60.00000000000001,Ondule
Penne,penne,penne rigate; Depending on size; mostaccioli; mostaccioli rigati; penne a candela; penne di Natale (Christmas; also called natalini); penne di ziti; penne di ziti rigati; penne di zitoni; pennoni; ziti tagliati; ziti tagliati rigati; zitoni tagliati. For the smallest size; penne di mezzane; pennette; pennette di mezzane rigate; pen- nette rigate; pennettine; pennettine rigate; pennine; pennine rigate; pennuzze; pen- nuzze rigate. For the largest size; zitoni; both cut on the bias; cut straight; both smooth; ridged. In Sicily; penne are also called maltagliati; when they are very short; at- tupateddi. See also ziti; zite.,Short,,"The name means literally “quills.” In 1865, Giovanni Battista Capurro, a pasta maker of San Martino d’Albaro (Genoa), asked for and obtained a mo- nopoly on the manufacture of a diagonal cutting machine. The machine made itpossible to cut…",,,,,Tube,,tube,1,1,0,0,medium,0,penne.png,penne.jpg,pene; pene rigate; penne rigate; rigate penne; Depending on size; mostaccioli; mostaccioli rigati; penne a candela; penne di Natale (Christmas; also called natalini); penne di ziti; penne di ziti rigati; penne di zitoni; pennoni; ziti tagliati; ziti tagliati rigati; zitoni tagliati. For the smallest size; penne di mezzane; pennette; pennette di mezzane rigate; pen- nette rigate; pennettine; pennettine rigate; pennine; pennine rigate; pennuzze; pen- nuzze rigate. For the largest size; zitoni; both cut on the bias; cut straight; both smooth; ridged. In Sicily; penne are also called maltagliati; when they are very short; at- tupateddi. See also ziti; zite.,,penne.jpg,tube; medium size; Ridged surface; Hollow center,Mezze Penne; Mostaccioli; Maccheroncini; Tufoli,Mezze Penne - Very similar geometry | Mostaccioli - Very similar geometry,Pastasciutta; Soup,,Chunky tomato sauces; Meat ragù; Baked casseroles,Ridges grip sauce.,,,Mezze Penne,Very similar geometry,Mostaccioli; Maccheroncini,Mostaccioli - Very similar geometry | Maccheroncini - Very similar geometry,Tufoli,Very similar geometry,extruded,,,,,,,penne,100.0,60.00000000000001,Penne
Pipe,pipe,,Short,,"Pipe rigate are curved, hollow, ridged pieces with a wide opening at one end and a more closed, flattened end; sources note the exact origin is unclear and sometimes debated by region.",https://sharethepasta.org/pasta-shapes/pipe-rigate/,,,,Elbow,,short,0,1,0,1,medium,0,pipe.png,,,,,short; medium size; Ridged surface; Curved shape,Chiocciole; Cavatelli; Perciatelli; Linguettine,Chiocciole - Very similar geometry | Cavatelli - solid vs hollow,Chunky sauces plus cream- or oil-based sauces - the curve and ridges help capture sauce.,https://sharethepasta.org/pasta-shapes/pipe-rigate/; https://valdigrano.com/en/speaking-of-pasta-pipe-rigate/,Tomato sauces; Cream sauces; Pesto,Versatile shape - pair by sauce thickness.,,,Chiocciole,Very similar geometry,Cavatelli; Perciatelli,Cavatelli - solid vs hollow | Perciatelli - Very similar geometry,Linguettine,Very similar geometry,extruded,,,,,,,,77.14285714285715,67.5,Pipe
Pantacce,pantacce,,Sheet,,"Pantacce are a Tuscan pasta shape with wavy edges and a squared/diamond form, commonly described as a typical pasta of Tuscany.",https://www.lamolisana.it/us/pasta/n-106-pantacce/,,,,Sheet,,sheet,0,0,0,0,medium,0,pantacce.png,,pantace,,,sheet; medium size; Smooth surface,Sagnarelli; Fisckariedd'; Lasagnette; Lasagne,Sagnarelli - Very similar geometry | Fisckariedd' - Very similar geometry,Pasta e fagioli (pasta and beans) and other thick soups; also good with rustic sauces.,https://www.lamolisana.it/us/pasta/n-106-pantacce/; https://seedsofitaly.com/la-molisana-pantacce-toscane-pasta-500g-n-106/,Cream sauces; Mushroom sauces; Slow-cooked ragù,Broad surfaces carry creamy or clingy sauces well.,,,Sagnarelli,Very similar geometry,Fisckariedd'; Lasagnette,Fisckariedd' - Very similar geometry | Lasagnette - Very similar geometry,Lasagne,Very similar geometry,rolled-cut,,,,,,,,69.23076923076923,65.45454545454547,pantace
Quadrefiore,quadrefiore,,Short,,,,,,,Other,,short,0,1,0,0,medium,0,quadrefiore.png,,,,,short; medium size; Ridged surface,Capricci; Assabesi; Francesine; Marziani,Capricci - Very similar geometry | Assabesi - Very similar geometry,,,Tomato sauces; Cream sauces; Pesto,Versatile shape - pair by sauce thickness.,,,Capricci,Very similar geometry,Assabesi; Francesine,Assabesi - Very similar geometry | Francesine - Very similar geometry,Marziani,Very similar geometry,extruded,,,,,,,,65.45454545454547,60.00000000000001,Quadrefiore
Radiatori,radiatori,,Short,,"Radiatori are a relatively recent pasta shape inspired by radiator-like ridges; because they’re modern, they don’t have a deep traditional dish canon compared to older shapes.",https://www.the-pasta-project.com/radiatori-radiator-shaped-pasta/,,,,Ruffle,,short,0,1,0,0,medium,0,radiatori.png,,,,,short; medium size; Ridged surface,Marziani; Francesine; Rocchetti; Capricci,Marziani - Very similar geometry | Francesine - Very similar geometry,"Thick tomato sauces, creamy sauces, and baked pasta dishes - the ridges hold sauce similarly to other short, twisted shapes.",https://www.the-pasta-project.com/radiatori-radiator-shaped-pasta/; https://pastaevangelists.com/blogs/blog/what-is-radiatori-pasta,Tomato sauces; Cream sauces; Pesto,Versatile shape - pair by sauce thickness.,,,Marziani,Very similar geometry,Francesine; Rocchetti,Francesine - Very similar geometry | Rocchetti - Very similar geometry,Capricci,Very similar geometry,extruded,,,,,,,,72.0,70.58823529411764,Radiatori
Ricciutelli,ricciutelli,,Short,,,,,,,Other,,short,0,0,0,1,medium,0,ricciutelli.png,,riciuteli,,,short; medium size; Smooth surface; Curved shape,Margherita Messinese Lunga; Ricciolini; Gramignoni; Perciatelli,Margherita Messinese Lunga - Very similar geometry | Ricciolini - Very similar geometry,,,Tomato sauces; Cream sauces; Pesto,Versatile shape - pair by sauce thickness.,,,Margherita Messinese Lunga,Very similar geometry,Ricciolini; Gramignoni,Ricciolini - Very similar geometry | Gramignoni - Very similar geometry,Perciatelli,smooth vs ridged,,,,,,,,,67.5,66.66666666666667,Ricciutelli
Rigatoncini,rigatoncini,,Short,,Rigatoncini are medium-small ridged tubes - a size between penne rigate and rigatoni (a “little rigatoni” format).,https://www.tasteatlas.com/rigatoncini ; https://www.manicaretti.com/catalog/pasta/classic-durum-wheat-pasta/rigatoncini,,,,Tube,,tube,1,1,0,0,small,0,rigatoncini.png,,,,,tube; small size; Ridged surface; Hollow center,Pennette; Ditalini; Cannolocchi; Penne,Pennette - Very similar geometry | Ditalini - ridged vs smooth,Pastasciutta; Baked,https://www.formaggiokitchen.com/rust-rigatoncini-500g/ ; https://www.manicaretti.com/catalog/pasta/classic-durum-wheat-pasta/rigatoncini,Chunky tomato sauces; Meat ragù; Baked casseroles,Ridges grip sauce.,,,Pennette,Very similar geometry,Ditalini; Cannolocchi,Ditalini - ridged vs smooth | Cannolocchi - different size,Penne,different size,extruded,,,,,,,,84.21052631578947,67.5,Rigatoncini
Rocchetti,rocchetti,,Short,,,,,,,Other,,short,0,1,0,0,medium,0,rocchetti.png,,rocheti,,,short; medium size; Ridged surface,Capricci; Assabesi; Quadrefiore; Ondule,Capricci - Very similar geometry | Assabesi - Very similar geometry,,,Tomato sauces; Cream sauces; Pesto,Versatile shape - pair by sauce thickness.,,,Capricci,Very similar geometry,Assabesi; Quadrefiore,Assabesi - Very similar geometry | Quadrefiore - Very similar geometry,Ondule,Very similar geometry,extruded,,,,,,,,84.21052631578947,84.21052631578947,Rocchetti
Sciviottini,sciviottini,,Short,,,,,,,Tube,,tube,1,0,0,0,medium,0,sciviottini.png,,sciviotini,,,tube; medium size; Smooth surface; Hollow center,Caserecce; Ziti; Mezzi Bombardoni; Paccheri,Caserecce - Very similar geometry | Ziti - Very similar geometry,,,Chunky tomato sauces; Meat ragù; Baked casseroles,Tubes hold sauce inside.,,,Caserecce,Very similar geometry,Ziti; Mezzi Bombardoni,Ziti - Very similar geometry | Mezzi Bombardoni - Very similar geometry,Paccheri,Very similar geometry,extruded,,,,,,,,63.52941176470588,63.1578947368421,sciviotini
Rotini,rotini,,Short,,"Rotini are short corkscrew spirals commonly used in everyday cooking, especially in the U.S.; they’re closely related in function to other spiral pastas (like fusilli) designed to distribute sauce evenly.",https://www.southernliving.com/best-pasta-shapes-for-pasta-salad-11728487,,,,Twist,,short,0,0,1,0,small,0,rotini.png,,,,,short; small size; Smooth surface; Twisted / spiral form,Trofiette; Strozzapreti; Dischi; Gemelli,Trofiette - plain vs curved | Strozzapreti - different size,"Pasta salads and lighter, oil-based dressings (like vinaigrettes) - the tight spiral holds dressing and small add-ins well; also works as an all-purpose short pasta.",https://www.mccormick.com/blogs/how-to/nothing-disappears-as-quickly-as-a-pasta-salad; https://www.southernliving.com/best-pasta-shapes-for-pasta-salad-11728487,Brothy soups; Light tomato soups; Simple butter/cheese,Small shapes are great for spoons and soups.,,,Trofiette,plain vs curved,Strozzapreti; Dischi,Strozzapreti - different size | Dischi - different size,Gemelli,different size,,,,,,,,,72.0,72.0,Rotini
Sorprese,sorprese,,Short,,"Sorprese ('surprises') are folded pasta shapes that resemble filled pasta like tortellini, but are typically made without filling.",https://www.bonappetit.com/test-kitchen/article/dried-pasta-shapes,,,,Other,,short,0,0,0,0,medium,0,sorprese.png,,,,,short; medium size; Smooth surface,Canestrini; Maltagliati; Abbotta Pezziende; Fiori,Canestrini - Very similar geometry | Maltagliati - Very similar geometry,Heavier sauces like meat ragùs - the folds and pockets give sauce places to cling.,https://www.bonappetit.com/test-kitchen/article/dried-pasta-shapes,Tomato sauces; Cream sauces; Pesto,Versatile shape - pair by sauce thickness.,,,Canestrini,Very similar geometry,Maltagliati; Abbotta Pezziende,Maltagliati - Very similar geometry | Abbotta Pezziende - Very similar geometry,Fiori,Very similar geometry,,,,,,,,,55.38461538461539,54.0,Sorprese
Sorprese Lisce,sorprese-lisce,,Short,,,,,,,Twist,,short,0,1,1,0,medium,0,sorprese-lisce.png,,lisce sorprese,,,short; medium size; Ridged surface; Twisted / spiral form,Funghetti; Strozzapreti; Gemelli; Dischi,Funghetti - Very similar geometry | Strozzapreti - ridged vs smooth,,,Tomato sauces; Cream sauces; Pesto,Versatile shape - pair by sauce thickness.,,,Funghetti,Very similar geometry,Strozzapreti; Gemelli,Strozzapreti - ridged vs smooth | Gemelli - ridged vs smooth,Dischi,ridged vs smooth,extruded,,,,,,,,57.14285714285714,56.00000000000001,Sorprese Lisce
Ruote,ruote,For the smallest sizes; r otelle; rotelline; but also r otine.,Short,,"Many machine- inspired pasta shapes of various sizes arrived with the industrial age, and particularly the automobile, in the early twentieth century . Thus, we have not only ru ote(wheels), but also radiatori (radiators) and lancette (a…",,,,,Ring,,ring,1,0,0,1,medium,0,ruote.png,,For the smallest sizes; r otelle; rotelline; but also r otine.,,,ring; medium size; Smooth surface; Hollow center; Curved shape,Calamarata; Occhi Di Passero; Gramigna; Messinesi,Calamarata - Very similar geometry | Occhi Di Passero - curved vs plain,Pastasciutta; Soup,,Tomato sauces; Cream sauces; Pesto,Versatile shape - pair by sauce thickness.,,,Calamarata,Very similar geometry,Occhi Di Passero; Gramigna,Occhi Di Passero - curved vs plain | Gramigna - different type,Messinesi,different type,extruded,,,,,,,,85.5,67.5,but also r otine.
Tufoli,tufoli,Cannaroni; cannaruncielli; cannerozzi. For small sizes; can- nelli; cannolicchi; diavoletti; diavolini; spolette; stortini; svuotini; tubetti. For larger sizes; cannelloni da ripieno (to be ﬁlled); canneroni; cannerozzi; fascette; mezze fascette; ﬁschioni; ﬁschiotti; maniche; schiaffettoni; schiaffoni; among similar shapes; napoleoni; zitelle; which are slightly curved; cavour; damigelle (damsels); which are straight.,Short,,"The vast terminology of pasta— and all the alternative names for tufoli are a good example— varies depending on where the pasta is made. The Neapoli- tan term cannerone refers to the animal gullet, which the pasta resembles in the pop u…",,,,,Tube,,tube,1,1,0,0,medium,0,tufoli.png,,Cannaroni; cannaruncielli; cannerozzi. For small sizes; can- nelli; cannolicchi; diavoletti; diavolini; spolette; stortini; svuotini; tubetti. For larger sizes; cannelloni da ripieno (to be ﬁlled); canneroni; cannerozzi; fascette; mezze fascette; ﬁschioni; ﬁschiotti; maniche; schiaffettoni; schiaffoni; among similar shapes; napoleoni; zitelle; which are slightly curved; cavour; damigelle (damsels); which are straight.,,,tube; medium size; Ridged surface; Hollow center,Penne; Mezze Penne; Mostaccioli; Maccheroncini,Penne - Very similar geometry | Mezze Penne - Very similar geometry,Pastasciutta; Soup,,Chunky tomato sauces; Meat ragù; Baked casseroles,Ridges grip sauce.,,,Penne,Very similar geometry,Mezze Penne; Mostaccioli,Mezze Penne - Very similar geometry | Mostaccioli - Very similar geometry,Maccheroncini,Very similar geometry,extruded,,,,,,,diavolini,100.0,75.0,diavolini
Fazzoletti,fazzoletti,fazzoletti di seta,Sheet,,"Fazzoletti (“handkerchiefs”) are large, thin pasta squares often made fresh; the wide sheets drape and fold, catching pools of sauce.",https://foragerchef.com/fazzoletti-the-handkerchief-pasta/ ; https://www.greatbritishchefs.com/recipes/silk-handkerchiefs-recipe,,,,Sheet,,sheet,0,0,0,0,small,0,fazzoletti.png,,fazoleti; fazoleti seta; fazzoletti seta; seta fazzoletti; fazzoletti di seta,,,sheet; small size; Smooth surface,Sagnarelli; Pantacce; Lasagnette; Lasagne,Sagnarelli - different size | Pantacce - different size,Pastasciutta,https://foragerchef.com/fazzoletti-the-handkerchief-pasta/,Cream sauces; Mushroom sauces; Slow-cooked ragù,Broad surfaces carry creamy or clingy sauces well.,,,Sagnarelli,different size,Pantacce; Lasagnette,Pantacce - different size | Lasagnette - different size,Lasagne,different size,rolled-cut,,,,,,,,85.5,85.5,fazzoletti di seta
Trennette,trennette,,Short,,"Trenette are narrow, flat ribbons from Liguria, where pesto Genovese originated; trenette is a classic pairing for pesto (often with potatoes and green beans).",https://lidiasitaly.com/recipes/trenette-pesto-genoa-style/ ; https://toriavey.com/ligurian-pasta-trenette/,,,,Other,,short,1,0,0,0,medium,0,trennette.png,,trenete,,,short; medium size; Smooth surface; Hollow center,Pasta Al Ceppo; Gianduieta; Trenne; Capunti,Pasta Al Ceppo - Very similar geometry | Gianduieta - Very similar geometry,Pastasciutta,https://lidiasitaly.com/recipes/trenette-pesto-genoa-style/,Tomato sauces; Cream sauces; Pesto,Versatile shape - pair by sauce thickness.,,,Pasta Al Ceppo,Very similar geometry,Gianduieta; Trenne,Gianduieta - Very similar geometry | Trenne - Very similar geometry,Capunti,smooth vs ridged,extruded,,,,,,,,84.70588235294117,72.0,Trennette
Trenne,trenne,,Short,,"Today, it is a gourmet treat, but both yesterday and today “advantaged” pasta— which is what avvantaggiata means literally, that is, containing some w hole-w heat fl our—c osts less than the normal white pasta made entirely with white flour: this was actually the advantage for the consumer, who could rarely afford to buy wheat pasta. Pasta… Where it’s most associated: Liguria, Genoa in part icu lar.","Encyclopedia of Pasta (matched 'trenette trenette avvantaggiate', score 90.0)",,,,Other,,short,1,0,0,0,medium,0,trenne.png,,trene,,,short; medium size; Smooth surface; Hollow center,Pasta Al Ceppo; Gianduieta; Trennette; Capunti,Pasta Al Ceppo - Very similar geometry | Gianduieta - Very similar geometry,With the typical sauces of Liguria,"Encyclopedia of Pasta (matched 'trenette trenette avvantaggiate', score 90.0)",Tomato sauces; Cream sauces; Pesto,Versatile shape - pair by sauce thickness.,,,Pasta Al Ceppo,Very similar geometry,Gianduieta; Trennette,Gianduieta - Very similar geometry | Trennette - Very similar geometry,Capunti,smooth vs ridged,extruded,,,,,,,trenette trenette avvantaggiate,90.0,72.0,trene
Ziti,ziti,zite; Busiata; maccheroni di zita. In Molise; they are called a pasta d’à festa; in Puglia; stivalette.,Short,,"The name means literally “grooms” or “brides.” This is the pasta for feast days in different regions. Pop u lar belief in Molise, for example, calls for making it on the Feast of the Epiphany (January 6) to ward off seeing the dev il on…",,,,,Tube,,tube,1,0,0,0,medium,0,ziti.png,,zite; Busiata; maccheroni di zita. In Molise; they are called a pasta d’à festa; in Puglia; stivalette.,,,tube; medium size; Smooth surface; Hollow center,Caserecce; Sciviottini; Mezzi Bombardoni; Paccheri,Caserecce - Very similar geometry | Sciviottini - Very similar geometry,Pastasciutta,,Chunky tomato sauces; Meat ragù; Baked casseroles,Tubes hold sauce inside.,,,Caserecce,Very similar geometry,Sciviottini; Mezzi Bombardoni,Sciviottini - Very similar geometry | Mezzi Bombardoni - Very similar geometry,Paccheri,Very similar geometry,extruded,,,,,,,ziti zite,90.0,77.14285714285715,Ziti
Trottole,trottole,,Short,,"Trottole are “spinning-top” shaped pasta; the name literally refers to spinning tops, and the shape is meant to hold sauces in its spirals.",https://en.wikipedia.org/wiki/List_of_pasta ; https://zellipasta.com/products/trottole,,,,Spiral,,short,0,0,1,0,medium,0,trottole.png,,trotole,,,short; medium size; Smooth surface; Twisted / spiral form,Fusilli; Ballerine; Cavatappi; Gemelli,Fusilli - Very similar geometry | Ballerine - smooth vs ridged,Pastasciutta; Salad,https://zellipasta.com/products/trottole,Tomato sauces; Cream sauces; Pesto,Versatile shape - pair by sauce thickness.,,,Fusilli,Very similar geometry,Ballerine; Cavatappi,Ballerine - smooth vs ridged | Cavatappi - smooth vs ridged; solid vs hollow,Gemelli,Very similar geometry,,,,,,,,,66.66666666666667,66.66666666666667,trotole
Mparrettati,mparrettati,,Short,,,,,,,Twist,,short,1,0,0,0,medium,0,mparrettati.png,,mparetati,,,short; medium size; Smooth surface; Hollow center,Fusi Istriani; Busiate; Fricelli; Pasta Al Ceppo,Fusi Istriani - plain vs twisted | Busiate - plain vs twisted,,,Tomato sauces; Cream sauces; Pesto,Versatile shape - pair by sauce thickness.,,,Fusi Istriani,plain vs twisted,Busiate; Fricelli,Busiate - plain vs twisted | Fricelli - hollow vs solid,Pasta Al Ceppo,Very similar geometry,extruded,,,,,,,,66.66666666666667,60.00000000000001,mparetati
Passatelli,passatelli,Lumachelle (snails).,Dumpling,,"Strictly speaking, passatelli do not belong in a cata log of pastas. But this tasty preparation deserves to be an exception.",,,,,Dumpling,,dumpling,0,0,0,0,medium,0,passatelli.png,,pasateli; Lumachelle (snails).,,,dumpling; medium size; Smooth surface,Gnocchetti Sardi; Gnocchi; Gnocchetti; Sacchettoni,Gnocchetti Sardi - Very similar geometry | Gnocchi - smooth vs ridged,Pastasciutta; Soup,,Tomato sauces; Cream sauces; Pesto,Versatile shape - pair by sauce thickness.,,,Gnocchetti Sardi,Very similar geometry,Gnocchi; Gnocchetti,Gnocchi - smooth vs ridged | Gnocchetti - different size,Sacchettoni,plain vs stuffed; different type,extruded,,,,,,,lumache,90.0,60.00000000000001,Lumachelle (snails).
Foglie D'Ulivo,foglie-d-ulivo,,Short,,"Foglie d’ulivo (“olive leaves”) are handmade pasta shaped like olive leaves, associated especially with Puglia (Apulia) and Liguria.",https://en.wikipedia.org/wiki/Foglie_d%27ulivo ; https://www.the-pasta-project.com/olive-leaf-pasta-foglie-dulivo/,,,,Other,,short,0,0,0,0,medium,0,foglie-d-ulivo.png,,foglie ulivo; ulivo foglie; dulivo foglie; foglie d ulivo,,,short; medium size; Smooth surface,Maltagliati; Sorprese; Abbotta Pezziende; Fiori,Maltagliati - Very similar geometry | Sorprese - Very similar geometry,Pastasciutta,https://www.the-pasta-project.com/olive-leaf-pasta-foglie-dulivo/,Tomato sauces; Cream sauces; Pesto,Versatile shape - pair by sauce thickness.,,,Maltagliati,Very similar geometry,Sorprese; Abbotta Pezziende,Sorprese - Very similar geometry | Abbotta Pezziende - Very similar geometry,Fiori,Very similar geometry,,,,,,,,,85.5,85.5,foglie d ulivo
Fusilli Bucati,fusilli-bucati,,Short,,,,,,,Spiral,,tube,1,0,1,0,medium,0,fusilli-bucati.png,,fusili bucati; bucati fusilli,,,tube; medium size; Smooth surface; Hollow center; Twisted / spiral form,Elicoidali; Cavatappi; Sciviottini; Ziti,Elicoidali - smooth vs ridged | Cavatappi - smooth vs ridged; different type,,,Chunky tomato sauces; Meat ragù; Baked casseroles,Tubes hold sauce inside.,,,Elicoidali,smooth vs ridged,Cavatappi; Sciviottini,Cavatappi - smooth vs ridged; different type | Sciviottini - twisted vs plain,Ziti,twisted vs plain,extruded,,,,,,,,77.14285714285715,67.5,Fusilli Bucati
Strozzapreti,strozzapreti,,Short,,"Strozzapreti (""priest chokers"") are hand-rolled, twisted pasta with multiple regional legends behind the anticlerical name; the term is used in several regions for similar rustic shapes.",https://en.wikipedia.org/wiki/Strozzapreti; https://italianfoodforever.com/2015/09/how-to-make-strozzapreti-step-by-step/,,,,Twist,,short,0,0,1,0,medium,0,strozzapreti.png,,strozapreti,,,short; medium size; Smooth surface; Twisted / spiral form,Ciocchetti; Dischi; Gemelli; Sorprese Lisce,Ciocchetti - Very similar geometry | Dischi - Very similar geometry,"Chunky sauces and ragùs - the twists and rough surface catch pieces of meat, veg, and cheese.",https://italianfoodforever.com/2015/09/how-to-make-strozzapreti-step-by-step/,Tomato sauces; Cream sauces; Pesto,Versatile shape - pair by sauce thickness.,,,Ciocchetti,Very similar geometry,Dischi; Gemelli,Dischi - Very similar geometry | Gemelli - Very similar geometry,Sorprese Lisce,smooth vs ridged,,,,,,,,,63.63636363636363,60.00000000000001,Strozzapreti
Orecchiette,orecchiette,little ears; Orecchini in Rome; r ecchietelle in Campania; Molise; Basilicata. In Abruzzo; Basilicata; they are called orecchie di prete; stac- chiodde; in the area of Lagonegro in Basilicata; they are called cicatelli; recchie de prevete; in Bari; chagghjubbi or fenescecchie; pestazzule; recchie; recchietedde; stagghiotte; strascenate; in Taranto; c hiancarelle are the small ones; pociacche or pochiacche the larger ones; in Lecce; they are called stac- chiodde.,Short,,"The name means literally “little ears.” The origin of orecchiette can possibly be traced back to the crosets of medieval Provence ,which are about the same shape. Made in the south of France with the locally grown durum wheat, they could…",,,,,Shell,,short,0,0,0,1,small,0,orecchiette.png,,orechiete; litle ears; little ears; Orecchini in Rome; r ecchietelle in Campania; Molise; Basilicata. In Abruzzo; Basilicata; they are called orecchie di prete; stac- chiodde; in the area of Lagonegro in Basilicata; they are called cicatelli; recchie de prevete; in Bari; chagghjubbi or fenescecchie; pestazzule; recchie; recchietedde; stagghiotte; strascenate; in Taranto; c hiancarelle are the small ones; pociacche or pochiacche the larger ones; in Lecce; they are called stac- chiodde.,,,short; small size; Smooth surface; Curved shape,Conchigliette; Conchiglioni; Lumachine; Tripolini,Conchigliette - smooth vs ridged | Conchiglioni - different size,Pastasciutta,,Brothy soups; Light tomato soups; Simple butter/cheese,Small shapes are great for spoons and soups.,,,Conchigliette,smooth vs ridged,Conchiglioni; Lumachine,Conchiglioni - different size | Lumachine - smooth vs ridged,Tripolini,smooth vs ridged,rolled-cut,,,,,,,,85.5,60.00000000000001,r ecchietelle in Campania
