ShapeName,Slug,Synonyms,Category,Description,HistoryBlurb,HistoryBlurb_Source,CityOrRegionMostAssociated,EarliestAttestedMention,SourceLink,PrimaryGeometry,KeyDiscriminators,Type,IsHollow,IsRidged,IsTwisted,IsCurved,SizeClass,IsStuffed,ThumbnailImage,PhotoImage,SearchAliases,HeroImageUncooked,HeroImageCooked,KeyTells,OftenConfusedWith,OftenConfusedWithWhy,BestFor,BestFor_Source,ClassicSaucePairings,ClassicSaucePairingsWhy,AvoidWith,AvoidWithWhy,SubstitutesClosest,SubstitutesClosestWhy,SubstitutesDecent,SubstitutesDecentWhy,SubstitutesEmergency,SubstitutesEmergencyWhy,MadeMethod,OriginRegion,Pronunciation,NameMeaning,Trivia,RecipeLinks,SeeAlsoSlugs,Book_MatchedEntry,Book_MatchScore,Book_MatchRunnerUpScore,Book_MatchFromAlias
Fricelli,fricelli,,Short,,"Fricelli are a southern Italian specialty shape (often linked to Puglia) with a thick, dumpling-like bite when cooked longer.",https://www.oliveoilandbeyond.com/Fricelli-Pasta-p/450.htm,,,,Twist,,short,0,0,0,0,medium,0,fricelli.png,,friceli,,,short; medium size; Smooth surface,Strozzapreti; Mparrettati; Gemelli; Dischi,Strozzapreti - plain vs twisted | Mparrettati - solid vs hollow,"Tomato sauces, meatballs, and hearty meat sauces that benefit from a substantial pasta.",https://www.oliveoilandbeyond.com/Fricelli-Pasta-p/450.htm,Tomato sauces; Cream sauces; Pesto,Versatile shape - pair by sauce thickness.,,,Strozzapreti,plain vs twisted,Mparrettati; Gemelli,Mparrettati - solid vs hollow | Gemelli - plain vs twisted,Dischi,plain vs twisted,,,,,,,,,78.75,77.77777777777779,Fricelli
Torchio,torchio,,Short,,,,,,,Other,,short,0,1,0,1,medium,0,torchio.png,,,,,short; medium size; Ridged surface; Curved shape,Linguettine; Perciatelli; Lanterne; Creste Di Gallo,Linguettine - Very similar geometry | Perciatelli - Very similar geometry,,,Tomato sauces; Cream sauces; Pesto,Versatile shape - pair by sauce thickness.,,,Linguettine,Very similar geometry,Perciatelli; Lanterne,Perciatelli - Very similar geometry | Lanterne - Very similar geometry,Creste Di Gallo,Very similar geometry,extruded,,,,,,,,64.28571428571429,61.53846153846154,Torchio
Mezzi Bombardoni,mezzi-bombardoni,,Short,,,,,,,Tube,,tube,1,0,0,0,medium,0,mezzi-bombardoni.png,,mezi bombardoni; bombardoni mezzi,,,tube; medium size; Smooth surface; Hollow center,Caserecce; Sciviottini; Ziti; Paccheri,Caserecce - Very similar geometry | Sciviottini - Very similar geometry,,,Chunky tomato sauces; Meat ragù; Baked casseroles,Tubes hold sauce inside.,,,Caserecce,Very similar geometry,Sciviottini; Ziti,Sciviottini - Very similar geometry | Ziti - Very similar geometry,Paccheri,Very similar geometry,extruded,,,,,,,,67.5,56.25,Mezzi Bombardoni
Pasta Al Ceppo,pasta-al-ceppo,,Short,,,,,,,Other,,short,1,0,0,0,medium,0,pasta-al-ceppo.png,,pasta cepo; ceppo pasta; pasta ceppo,,,short; medium size; Smooth surface; Hollow center,Trennette; Gianduieta; Trenne; Capunti,Trennette - Very similar geometry | Gianduieta - Very similar geometry,,,Tomato sauces; Cream sauces; Pesto,Versatile shape - pair by sauce thickness.,,,Trennette,Very similar geometry,Gianduieta; Trenne,Gianduieta - Very similar geometry | Trenne - Very similar geometry,Capunti,smooth vs ridged,extruded,,,,,,,,85.5,63.33333333333332,pasta cepo
Caserecce,caserecce,,Short,,Casarecce are short twists often associated with Southern Italy (especially Sicily) and designed to catch sauces in their folds.,https://www.the-pasta-project.com/casarecce-pasta-with-sicilian-pesto/; https://mangiawithmichele.com/casarecce-alla-norma/,,,,Tube,,tube,1,0,0,0,medium,0,caserecce.png,,caserece,,,tube; medium size; Smooth surface; Hollow center,Manicotti; Ziti; Mezzi Bombardoni; Paccheri,Manicotti - Very similar geometry | Ziti - Very similar geometry,Chunky vegetable sauces and Sicilian pairings like alla Norma (tomato + eggplant + ricotta salata) or tomato-based pestos.,https://mangiawithmichele.com/casarecce-alla-norma/; https://www.giallozafferano.com/recipes/casarecce-with-sicilian-pesto.html,Chunky tomato sauces; Meat ragù; Baked casseroles,Tubes hold sauce inside.,,,Manicotti,Very similar geometry,Ziti; Mezzi Bombardoni,Ziti - Very similar geometry | Mezzi Bombardoni - Very similar geometry,Paccheri,Very similar geometry,extruded,,,,,,,,60.00000000000001,57.14285714285714,Caserecce
Paccheri,paccheri,,Short,,"Paccheri are very large tube pasta associated with Southern Italy (especially Campania/Neapolitan cooking), prized as a ""vehicle"" for robust sauces that can coat and fill the tubes.",https://www.cookeatworld.com/paccheri-pasta-neapolitan-ragu/; https://www.the-pasta-project.com/7-italian-paccheri-recipes-worth-trying/,,,,Tube,,tube,1,0,0,0,medium,0,paccheri.png,,pacheri,,,tube; medium size; Smooth surface; Hollow center,Manicotti; Ziti; Mezzi Bombardoni; Caserecce,Manicotti - Very similar geometry | Ziti - Very similar geometry,Rich ragùs (especially Neapolitan-style) and seafood ragùs - big pieces and thick sauce cling to and slide inside the tubes.,https://www.cookeatworld.com/paccheri-pasta-neapolitan-ragu/; https://www.greatitalianchefs.com/recipes/paccheri-with-seafood-ragu-recipe,Chunky tomato sauces; Meat ragù; Baked casseroles,Tubes hold sauce inside.,,,Manicotti,Very similar geometry,Ziti; Mezzi Bombardoni,Ziti - Very similar geometry | Mezzi Bombardoni - Very similar geometry,Caserecce,Very similar geometry,extruded,,,,,,,,72.0,72.0,Paccheri
Tortiglioni,tortiglioni,Depending on size; eliche; fusilli; fusilli a spirale; fusilloni; spirali (all types of spirals); gemelli (twins); riccioli (curls).,Short,,"The name refers to the shape and derives from the Vulgar Latin tor- tillare, which in turn is derived from the Classical Latin torquere, or “twist” (as in En glish “torsion”). Tortillare evolved into the Vulgar Italian tortigliare; thus…",,,,,Tube,,tube,1,1,1,0,large,0,tortiglioni.png,,Depending on size; eliche; fusilli; fusilli a spirale; fusilloni; spirali (all types of spirals); gemelli (twins); riccioli (curls).,,,tube; large size; Ridged surface; Hollow center; Twisted / spiral form,Rigatoni; Canneroni; Maccheroni; Elicoidali,Rigatoni - twisted vs plain | Canneroni - twisted vs plain,Pastasciutta,,Chunky tomato sauces; Meat ragù; Baked casseroles,Ridges grip sauce.,,,Rigatoni,twisted vs plain,Canneroni; Maccheroni,Canneroni - twisted vs plain | Maccheroni - twisted vs plain,Elicoidali,different size,extruded,,,,,,,,85.5,85.5,fusilli a spirale
Gnocchi,gnocchi,Gnocchi alla romana. In Trentino; canederli di gries; dinia; pillas.,Dumpling,,"This is one of the few dishes in the Roman repertory worthy of an el- egant and important meal, and is one of the most pop u lar. Ada Boni, the great writer on cucina romana,102presents them as they used to be, in a dome.",,,,,Dumpling,,dumpling,0,1,0,0,medium,0,gnocchi.png,,gnochi; Gnocchi alla romana. In Trentino; canederli di gries; dinia; pillas.,,,dumpling; medium size; Ridged surface,Gnocchetti Sardi; Passatelli; Gnocchetti; Assabesi,Gnocchetti Sardi - ridged vs smooth | Passatelli - ridged vs smooth,Baked,,Tomato sauces; Cream sauces; Pesto,Versatile shape - pair by sauce thickness.,,,Gnocchetti Sardi,ridged vs smooth,Passatelli; Gnocchetti,Passatelli - ridged vs smooth | Gnocchetti - ridged vs smooth; different size,Assabesi,different type,extruded,,,,,,,,90.0,90.0,Gnocchi
Gnocchetti Sardi,gnocchetti-sardi,,Dumpling,,,,,,,Dumpling,,dumpling,0,0,0,0,medium,0,gnocchetti-sardi.png,,gnocheti sardi; sardi gnocchetti,,,dumpling; medium size; Smooth surface,Passatelli; Gnocchi; Gnocchetti; Sacchettoni,Passatelli - Very similar geometry | Gnocchi - smooth vs ridged,,,Tomato sauces; Cream sauces; Pesto,Versatile shape - pair by sauce thickness.,,,Passatelli,Very similar geometry,Gnocchi; Gnocchetti,Gnocchi - smooth vs ridged | Gnocchetti - different size,Sacchettoni,plain vs stuffed; different type,,,,,,,,gnocchetti,90.0,81.81818181818181,Gnocchetti Sardi
Capricci,capricci,,Short,,,,,,,Other,,short,0,1,0,0,medium,0,capricci.png,,caprici,,,short; medium size; Ridged surface,Assabesi; Quadrefiore; Ondule; Francesine,Assabesi - Very similar geometry | Quadrefiore - Very similar geometry,,,Tomato sauces; Cream sauces; Pesto,Versatile shape - pair by sauce thickness.,,,Assabesi,Very similar geometry,Quadrefiore; Ondule,Quadrefiore - Very similar geometry | Ondule - Very similar geometry,Francesine,Very similar geometry,extruded,,,,,,,,77.14285714285715,69.23076923076923,caprici
Ditalini,ditalini,ditali; thimbles,Short,,"Ditalini (""small thimbles"") are tiny tube-shaped pasta. They became more widely produced alongside other short-cut pastas during industrial pasta-making in places like Apulia.",https://en.wikipedia.org/wiki/Ditalini; https://www.delallo.com/blog/what-is-ditalini-pasta,,,,Tube,,tube,1,0,0,0,small,0,ditalini.png,,ditali; thimbles,,,tube; small size; Smooth surface; Hollow center,Pennette; Rigatoncini; Ziti; Cannolocchi Medi,Pennette - smooth vs ridged | Rigatoncini - smooth vs ridged,"Soups and spoonable dishes (minestrone, pasta e fagioli) and also pasta salads - the small open tubes nestle into broth and trap beans/veg.",https://en.wikipedia.org/wiki/Ditalini; https://www.delallo.com/blog/what-is-ditalini-pasta,Chunky tomato sauces; Meat ragù; Baked casseroles,Tubes hold sauce inside.,,,Pennette,smooth vs ridged,Rigatoncini; Ziti,Rigatoncini - smooth vs ridged | Ziti - different size,Cannolocchi Medi,different size,extruded,,,,,,,,82.35294117647058,66.66666666666667,Ditalini
Farfalle,farfalle,bow tie pasta; bow-ties; bowties; farfalline (small); bow ties; Fiocchetti (bows); stricchetti. In Piedmont; around Cuneo; sciancon; in Umbria; ﬁocchetti; in Abruzzo; Puglia; nocchette; in Calabria; canestrini; galani; nastrini; nodini; stricchetti; stricchetti bolognesi; farfalloni; francesine; galani.,Short,,"The name means literally “butterﬂies.”70The names of many factory- made pastas refer to the animal kingdom, including tiny chiocciolette, mezze chioc- ciolette, and lumachine (all meaning “little snails”); coralli and corallini (coral)…",,,,,Bowtie,,short,0,0,0,0,medium,0,farfalle.png,,bowties; farfale; bow ties; farfaline; farfalline; bow tie pasta; Fiocchetti (bows); stricchetti. In Piedmont; around Cuneo; sciancon; in Umbria; ﬁocchetti; in Abruzzo; Puglia; nocchette; in Calabria; canestrini; galani; nastrini; nodini; stricchetti; stricchetti bolognesi; farfalloni; francesine; galani.,,,short; medium size; Smooth surface,Canestrini; Maltagliati; Sorprese; Abbotta Pezziende,Canestrini - Very similar geometry | Maltagliati - Very similar geometry,Pastasciutta; Soup,,Tomato sauces; Cream sauces; Pesto,Versatile shape - pair by sauce thickness.,,,Canestrini,Very similar geometry,Maltagliati; Sorprese,Maltagliati - Very similar geometry | Sorprese - Very similar geometry,Abbotta Pezziende,Very similar geometry,sheet-formed,,,,,,,,85.71428571428572,69.56521739130434,stricchetti
Maccheroni,maccheroni,Macaroni; Caratelle; tonnarelli in Lazio; crioli in Molise; stringhetti in the Marche.,Short,,The chitarra consists of a wooden frame (beech or other neutral wood) strung with parallel steel wires. The space between the wires varies according to the type of pasta desired.,,,,,Tube,,tube,1,1,0,0,large,0,maccheroni.png,,macaroni; macheroni; Caratelle; tonnarelli in Lazio; crioli in Molise; stringhetti in the Marche.,,,tube; large size; Ridged surface; Hollow center,Canneroni; Rigatoni; Tortiglioni; Cannelloni,Canneroni - Very similar geometry | Rigatoni - Very similar geometry,Pastasciutta,,Chunky tomato sauces; Meat ragù; Baked casseroles,Ridges grip sauce.,,,Canneroni,Very similar geometry,Rigatoni; Tortiglioni,Rigatoni - Very similar geometry | Tortiglioni - plain vs twisted,Cannelloni,ridged vs smooth,sheet-formed,,,,,,,,90.0,90.0,Maccheroni
Fusilli,fusilli,fusilli napoletani; fusilli calabresi; In Piedmont; macaron dell’Alta Langa. In the V eneto; subioti and; with a different shape; fusarioi; around Piacenza; maccheroni bobbiesi. In Abruzzo; Molise; northern Lazio; ciufolitti; but also sfusellati; zufoletti; gnocchi col ferro. In Puglia; fenescecchie; ferricieddi; fricelli; lombrichelli; maccheroni a ferrittus; but also code di topo; fusidde (in Bari); fusille; maccarune a ﬁerre; ﬁrzuli; ﬁschietti; ﬁllil; fusiddri; ﬁlatelli; around Crotone; scilatielli. In Sardinia; maccarones inferrettati; maccarones a ferrittus; fusilli ad alette; fusilloni; gemelli; riccioli; spirali; tortiglioni.,Short,,"When the nascent pasta industry appropriated this par tic u lar shape, it had to think about how to differentiate it from the normal bucatino or perciatello: the women workers would take just- made perciatelli, wrap them around a ferr etto…",,,,,Spiral,,short,0,0,1,0,medium,0,fusilli.png,,fusili; fusili calabresi; calabresi fusilli; fusili napoletani; fusilli calabresi; fusilli napoletani; napoletani fusilli; In Piedmont; macaron dell’Alta Langa. In the V eneto; subioti and; with a different shape; fusarioi; around Piacenza; maccheroni bobbiesi. In Abruzzo; Molise; northern Lazio; ciufolitti; but also sfusellati; zufoletti; gnocchi col ferro. In Puglia; fenescecchie; ferricieddi; fricelli; lombrichelli; maccheroni a ferrittus; but also code di topo; fusidde (in Bari); fusille; maccarune a ﬁerre; ﬁrzuli; ﬁschietti; ﬁllil; fusiddri; ﬁlatelli; around Crotone; scilatielli. In Sardinia; maccarones inferrettati; maccarones a ferrittus; fusilli ad alette; fusilloni; gemelli; riccioli; spirali; tortiglioni.,,,short; medium size; Smooth surface; Twisted / spiral form,Trottole; Ballerine; Cavatappi; Ciocchetti,Trottole - Very similar geometry | Ballerine - smooth vs ridged,Pastasciutta,,Tomato sauces; Cream sauces; Pesto,Versatile shape - pair by sauce thickness.,,,Trottole,Very similar geometry,Ballerine; Cavatappi,Ballerine - smooth vs ridged | Cavatappi - smooth vs ridged; solid vs hollow,Ciocchetti,Very similar geometry,extruded,,,,,,,lombrichelli,100.0,81.81818181818181,lombrichelli
Chiocciole,chiocciole,,Short,,"Chiocciole ('snails') are short, curved shell-like pasta designed to trap sauce in their hollow center.",https://www.delallo.com/blog/lumache-recipes/; https://en.wikipedia.org/wiki/List_of_pasta,,,,Elbow,,short,0,1,0,1,medium,0,chiocciole.png,,chiociole,,,short; medium size; Ridged surface; Curved shape,Pipe; Cavatelli; Perciatelli; Linguettine,Pipe - Very similar geometry | Cavatelli - solid vs hollow,"Chunky tomato sauces, meat ragùs, and baked pasta; also works well in hearty soups.",https://www.delallo.com/blog/lumache-recipes/,Tomato sauces; Cream sauces; Pesto,Versatile shape - pair by sauce thickness.,,,Pipe,Very similar geometry,Cavatelli; Perciatelli,Cavatelli - solid vs hollow | Perciatelli - Very similar geometry,Linguettine,Very similar geometry,extruded,,,,,,,,75.0,70.58823529411764,chiociole
Anelli,anelli,,Soup (Pastina),,"The name derives from the dialect word garganel,meaning “chicken’s gullet,” which the ridgedgarganello resembles. The ridges, made with a pettine, hold the sauce better than a smooth surface. Where it’s most associated: Emilia-R omagna (a specialty of Lugo di Romagna), but also in the Marche and Umbria.","Encyclopedia of Pasta (matched 'garganelli', score 90.0)",,,,Other,,soup,0,0,0,0,small,0,anelli.png,,aneli,,,soup; small size; Smooth surface,Filini; Quadretti; Paternoster; Anchellini,Filini - Very similar geometry | Quadretti - Very similar geometry,"They used to be cooked only in broth, especially of capon, but today they are traditionally served as pastasciutta,dressed with a hearty meat ragù","Encyclopedia of Pasta (matched 'garganelli', score 90.0)",Brothy soups; Light tomato soups; Simple butter/cheese,Small shapes are great for spoons and soups.,,,Filini,Very similar geometry,Quadretti; Paternoster,Quadretti - Very similar geometry | Paternoster - Very similar geometry,Anchellini,Very similar geometry,,,,,,,,garganelli,90.0,75.00000000000001,Anelli
Acini de Pepe,acini-de-pepe,Acini di pepe; peppercorn pasta; peppercorns,Soup (Pastina),,,,,,,Grain/Tiny,,soup,0,0,0,0,small,0,acini-de-pepe.png,,acini pepe; pepe acini; pepercorns; peppercorns; acini di pepe; pepercorn pasta; pasta peppercorn; peppercorn pasta,,,soup; small size; Smooth surface,Midolline; Tempesta; Puntine; Orzo,Midolline - Very similar geometry | Tempesta - Very similar geometry,,,Brothy soups; Light tomato soups; Simple butter/cheese,Small shapes are great for spoons and soups.,,,Midolline,Very similar geometry,Tempesta; Puntine,Tempesta - Very similar geometry | Puntine - Very similar geometry,Orzo,Very similar geometry,,,,,,,,,85.5,85.5,Acini di pepe
Alfabeto,alfabeto,alphabet pasta; No alternative names.,Soup (Pastina),,"Literally “alphabet,” the alfabeto was surely invented to amuse children, the usual consumers of pappe and minestrine, as were stelline (little stars), cuoricini (little hearts) ,and a whole variety of other tiny shapes that evoke the…",,,,,Grain/Tiny,,soup,0,0,0,0,small,0,alfabeto.png,,alphabet pasta; pasta alphabet; No alternative names.,,,soup; small size; Smooth surface,Midolline; Tempesta; Puntine; Orzo,Midolline - Very similar geometry | Tempesta - Very similar geometry,Soup,,Brothy soups; Light tomato soups; Simple butter/cheese,Small shapes are great for spoons and soups.,,,Midolline,Very similar geometry,Tempesta; Puntine,Tempesta - Very similar geometry | Puntine - Very similar geometry,Orzo,Very similar geometry,extruded,,,,,,,alfabeto,100.0,55.55555555555556,Alfabeto
Anchellini,anchellini,,Soup (Pastina),,,,,,,Other,,soup,0,0,0,0,small,0,anchellini.png,,anchelini,,,soup; small size; Smooth surface,Filini; Quadretti; Paternoster; Farfalline,Filini - Very similar geometry | Quadretti - Very similar geometry,,,Brothy soups; Light tomato soups; Simple butter/cheese,Small shapes are great for spoons and soups.,,,Filini,Very similar geometry,Quadretti; Paternoster,Quadretti - Very similar geometry | Paternoster - Very similar geometry,Farfalline,Very similar geometry,,,,,,,,,75.0,64.28571428571429,anchelini
Anellini,anellini,,Soup (Pastina),,"Anellini (small rings) are strongly associated with Sicily, where they’re famously baked into timballi and celebratory pasta bakes (anelletti al forno).",https://www.the-pasta-project.com/baked-anelletti/; https://www.lacucinaitaliana.com/trends/restaurants-and-chefs/anelletti-al-forno-sicilian-baked-pasta-by-chef-fraterrigo,,,,Grain/Tiny,,soup,0,0,0,1,small,0,anellini.png,,anelini,,,soup; small size; Smooth surface; Curved shape,Risi; Grano; Midolline; Orzo,Risi - curved vs plain | Grano - curved vs plain,"Baked pasta casseroles/timballo with ragù, peas, cheese and breadcrumbs; also works in hearty soups.",https://www.the-pasta-project.com/baked-anelletti/; https://www.prouditaliancook.com/2018/02/anelletti-al-forno-little-baked-pasta-rings.html,Brothy soups; Light tomato soups; Simple butter/cheese,Small shapes are great for spoons and soups.,,,Risi,curved vs plain,Grano; Midolline,Grano - curved vs plain | Midolline - curved vs plain,Orzo,curved vs plain,,,,,,,,,85.71428571428572,70.58823529411764,anelini
Cocciolette,cocciolette,,Short,,,,,,,Shell,,short,1,0,0,0,medium,0,cocciolette.png,,cociolete,,,short; medium size; Smooth surface; Hollow center,Cappelli Napoletani; Mparrettati; Trenne; Pasta Al Ceppo,Cappelli Napoletani - Very similar geometry | Mparrettati - Very similar geometry,,,Tomato sauces; Cream sauces; Pesto,Versatile shape - pair by sauce thickness.,,,Cappelli Napoletani,Very similar geometry,Mparrettati; Trenne,Mparrettati - Very similar geometry | Trenne - Very similar geometry,Pasta Al Ceppo,Very similar geometry,extruded,,,,,,,,70.0,65.45454545454547,Cocciolette
Gianduieta,gianduieta,Animal;,Short,,,,,,,Other,,short,1,0,0,0,medium,0,gianduieta.png,,animal,,,short; medium size; Smooth surface; Hollow center,Pasta Al Ceppo; Trennette; Trenne; Capunti,Pasta Al Ceppo - Very similar geometry | Trennette - Very similar geometry,,,Tomato sauces; Cream sauces; Pesto,Versatile shape - pair by sauce thickness.,,,Pasta Al Ceppo,Very similar geometry,Trennette; Trenne,Trennette - Very similar geometry | Trenne - Very similar geometry,Capunti,smooth vs ridged,extruded,,,,,,,,65.45454545454547,60.00000000000001,Animal
Coralli,coralli,Corallina; corallini; ditaletti; tubettini; in Sicily; coradduzza.,Soup (Pastina),,"The name, which literally means “corals,” refers to a typical female or- nament, once common among the populations of the Mediterranean coast,cor alli 85 where coral ﬁshing was widely practiced. The simplest coral bead was a tiny tube…",,,,,Shell,,soup,0,0,0,0,small,0,coralli.png,,corali; Corallina; corallini; ditaletti; tubettini; in Sicily; coradduzza.,,,soup; small size; Smooth surface,Filini; Cuscus; Grano; Grattoni,Filini - Very similar geometry | Cuscus - Very similar geometry,Soup,,Brothy soups; Light tomato soups; Simple butter/cheese,Small shapes are great for spoons and soups.,,,Filini,Very similar geometry,Cuscus; Grano,Cuscus - Very similar geometry | Grano - Very similar geometry,Grattoni,Very similar geometry,extruded,,,,,,,coralli,100.0,66.66666666666667,Coralli
Farfalline,farfalline,,Soup (Pastina),,Farfalline ('little butterflies') are mini bow-tie pastina commonly used in soups and simple comfort preparations.,https://www.thepastatable.com/post/farfalline-pastina; https://www.cucinabyelena.com/italian-pastina-soup-recipe-with-chicken-broth/,,,,Other,,soup,0,0,0,0,small,0,farfalline.png,,farfaline,,,soup; small size; Smooth surface,Quadrucci; Merletti; Quadretti; Margherite,Quadrucci - Very similar geometry | Merletti - Very similar geometry,Brothy soups and quick comfort bowls cooked in stock and finished with butter and cheese.,https://www.thepastatable.com/post/farfalline-pastina; https://www.themediterraneandish.com/pastina-soup/,Brothy soups; Light tomato soups; Simple butter/cheese,Small shapes are great for spoons and soups.,,,Quadrucci,Very similar geometry,Merletti; Quadretti,Merletti - Very similar geometry | Quadretti - Very similar geometry,Margherite,Very similar geometry,,,,,,,,,75.00000000000001,67.5,Farfalline
Fregula,fregula,No alternative names.fregula 117,Soup (Pastina),,"The production of durum- wheat ﬂour dates to the Middle Ages in Sar- dinia. According to the fourteenth- century statute of the millers of Tempio Pau- sania, the mills could produce pasta from Monday to Friday , but on Saturday andSunday…",,,,,Grain/Tiny,,soup,0,0,0,0,small,0,fregula.png,,No alternative names.fregula 117,,,soup; small size; Smooth surface,Midolline; Tempesta; Puntine; Orzo,Midolline - Very similar geometry | Tempesta - Very similar geometry,Soup,,Brothy soups; Light tomato soups; Simple butter/cheese,Small shapes are great for spoons and soups.,,,Midolline,Very similar geometry,Tempesta; Puntine,Tempesta - Very similar geometry | Puntine - Very similar geometry,Orzo,Very similar geometry,,,,,,,,fregula,100.0,62.5,Fregula
Filini,filini,,Soup (Pastina),,"Filini are very small, short vermicelli-like strands (a pastina form) commonly used as a soup pasta.",https://www.the-pasta-project.com/what-is-pastina-pasta/,,,,Other,,soup,0,0,0,0,small,0,filini.png,,,,,soup; small size; Smooth surface,Quadrucci; Merletti; Quadretti; Margherite,Quadrucci - Very similar geometry | Merletti - Very similar geometry,Clear broths and light soups; also works in simple butter-and-cheese comfort bowls.,https://www.the-pasta-project.com/what-is-pastina-pasta/; https://www.delallo.com/blog/what-is-orzo/,Brothy soups; Light tomato soups; Simple butter/cheese,Small shapes are great for spoons and soups.,,,Quadrucci,Very similar geometry,Merletti; Quadretti,Merletti - Very similar geometry | Quadretti - Very similar geometry,Margherite,Very similar geometry,,,,,,,,,75.00000000000001,75.00000000000001,Filini
Cuscus,cuscus,Cuscussu; Cous Cous; Cascà or cashcà in Sardinia; cuscussù in Tuscany; cuscusu in Sicily .,Soup (Pastina),,"According to the earliest citations, semola cooked in soup, a sort of po- lentina simmered in milk or broth, was considered a luxury dish. In fact, at the be- ginning of the ﬁfteenth century , it was served at the table of Amedeo VIII…",,,,,Grain/Tiny,,soup,0,0,0,0,small,0,cuscus.png,,cuscusu; cuscussu; cous cous; Cascà or cashcà in Sardinia; cuscussù in Tuscany; cuscusu in Sicily .,,,soup; small size; Smooth surface,Midolline; Tempesta; Puntine; Orzo,Midolline - Very similar geometry | Tempesta - Very similar geometry,,,Brothy soups; Light tomato soups; Simple butter/cheese,Small shapes are great for spoons and soups.,,,Midolline,Very similar geometry,Tempesta; Puntine,Tempesta - Very similar geometry | Puntine - Very similar geometry,Orzo,Very similar geometry,,,,,,,,cuscus,100.0,60.00000000000001,Cuscus
Grano,grano,,Soup (Pastina),,"Grano ('grain') is a tiny pastina shape meant to mimic small grains, used as a soup pasta in the broader pastina family.",https://www.the-pasta-project.com/what-is-pastina-pasta/; https://chefshop.com/products/casa-del-grano-traditional-pastina-soup-pasta,,,,Grain/Tiny,,soup,0,0,0,0,small,0,grano.png,,,,,soup; small size; Smooth surface,Midolline; Tempesta; Puntine; Orzo,Midolline - Very similar geometry | Tempesta - Very similar geometry,Broths and minestrone-style soups; cooks quickly and disappears into the spoon.,https://www.the-pasta-project.com/what-is-pastina-pasta/,Brothy soups; Light tomato soups; Simple butter/cheese,Small shapes are great for spoons and soups.,,,Midolline,Very similar geometry,Tempesta; Puntine,Tempesta - Very similar geometry | Puntine - Very similar geometry,Orzo,Very similar geometry,,,,,,,,grumi di grano saraceno,90.0,67.5,Grano
